{"checks":[{"code":"member-indexes","count":5,"status":"passed"},{"code":"target-members","count":129,"status":"passed"},{"code":"ordinary-artifacts","count":903,"status":"passed"},{"code":"canonical-target-artifacts","count":475,"status":"passed","summary":"source-to-target mapping sha256 7e83834dc425c76dbef9698816fe455a4dfe86b8496469ef489d1d12365822d3"},{"code":"capability-indexes","count":3,"status":"passed"},{"code":"capability-artifacts","count":149,"status":"passed"},{"code":"stable-additions","count":3,"status":"passed"},{"code":"run-replacements","count":94,"status":"passed"},{"code":"stable-removals","count":0,"status":"passed"},{"code":"upstream-fetches","count":0,"status":"passed"}],"completed_at":"2026-07-19T19:35:46Z","report_id":"db31-source-validation","schema_version":1,"started_at":"2026-07-19T19:35:46Z","status":"passed","subject":{"id":"2026-07-19.31","type":"release"},"summary":"Accepted DB28-DB30 local inputs were verified exactly; unsorted Parquet inputs were deterministically ordered into new immutable target objects without upstream access.","validator":{"git_commit":"cad3c035760b54312012e6d8f16bff8c211a7243","image_digest":"sha256:9c902ab226daf0d848bd3fa2012495e5375a036c5b5adcd645974eafb9c4215c"}}
